{
  "id": "synthetic-dach-content-001",
  "unique_viewers_JOYN_AVOD_1d": 12,
  "unique_viewers_JOYN_AVOD_2d": null,
  "unique_viewers_JOYN_AVOD_7d": null,
  "unique_viewers_JOYN_SVOD_1d": null,
  "unique_viewers_JOYN_SVOD_2d": null,
  "unique_viewers_JOYN_SVOD_7d": null,
  "unique_viewers_JOYN_AT_AVOD_1d": null,
  "unique_viewers_JOYN_AT_AVOD_2d": null,
  "unique_viewers_JOYN_AT_AVOD_7d": null,
  "unique_viewers_JOYN_AT_SVOD_1d": null,
  "unique_viewers_JOYN_AT_SVOD_2d": null,
  "unique_viewers_JOYN_AT_SVOD_7d": null,
  "unique_viewers_JOYN_CH_AVOD_1d": null,
  "unique_viewers_JOYN_CH_AVOD_2d": null,
  "unique_viewers_JOYN_CH_AVOD_7d": null,
  "unique_viewers_JOYN_CH_SVOD_1d": null,
  "unique_viewers_JOYN_CH_SVOD_2d": null,
  "unique_viewers_JOYN_CH_SVOD_7d": null,
  "views_JOYN_AVOD_1d": 42,
  "views_JOYN_AVOD_2d": null,
  "views_JOYN_AVOD_7d": null,
  "views_JOYN_SVOD_1d": null,
  "views_JOYN_SVOD_2d": null,
  "views_JOYN_SVOD_7d": null,
  "views_JOYN_AT_AVOD_1d": null,
  "views_JOYN_AT_AVOD_2d": null,
  "views_JOYN_AT_AVOD_7d": null,
  "views_JOYN_AT_SVOD_1d": null,
  "views_JOYN_AT_SVOD_2d": null,
  "views_JOYN_AT_SVOD_7d": null,
  "views_JOYN_CH_AVOD_1d": null,
  "views_JOYN_CH_AVOD_2d": null,
  "views_JOYN_CH_AVOD_7d": null,
  "views_JOYN_CH_SVOD_1d": null,
  "views_JOYN_CH_SVOD_2d": null,
  "views_JOYN_CH_SVOD_7d": null
}
